{
  "claim_ceiling": "Filesystem/run provenance inventory only; no directory name or manifest flag establishes scientific finality.",
  "reconciliation": {
    "current_physical_directories": 35,
    "current_physical_unregistered": 26,
    "explanation_18_19_35": "18 logical data rows + 1 TSV header = 19 file lines; 35 is the current canonical physical-directory count. The complete physical inventory is 35 current + 16 pending archive = 51.",
    "logical_manifest_rows": 18,
    "logical_rows_merged_current": 9,
    "logical_rows_merged_pending_archive": 9,
    "manifest_file_lines": 19,
    "manifest_header_lines": 1,
    "merge_policy": "A logical row is metadata merged into its matching physical directory by canonical run path or the same sample/mode/run relative path under _ARCHIVE_pending_cleanup_202606/canonical; it never creates a duplicate record.",
    "pending_archive_extras": 7,
    "pending_archive_physical_directories": 16,
    "physical_directories_total": 51
  },
  "records": [
    {
      "availability": "LOCAL_CANONICAL",
      "evidence_status": "PARTIAL",
      "filesystem_mtime": "2026-03-16T06:22:59+08:00",
      "finality": "NON_FINAL",
      "known_limits": [
        "Physical directory presence and name do not establish scientific finality.",
        "Not present in the 18-row logical master manifest; directory is explicitly unregistered."
      ],
      "last_seen_at": "2026-08-13T11:21:47+08:00",
      "layout_class": "COMPLETE_MATRIX",
      "logical_manifest_member": false,
      "logical_manifest_metadata": null,
      "logical_manifest_run_id": null,
      "machine_locations": [
        {
          "last_seen_at": "2026-08-13T11:21:47+08:00",
          "location_status": "PRESENT",
          "machine": "bip7",
          "path": "/big7_disk/liaoyoyo2001/big7_disk_output/canonical/COLO829/paired_full/20260315_COLO829_paired_full_full_complete_matrix"
        }
      ],
      "mode": "paired_full",
      "physical_path": "/big7_disk/liaoyoyo2001/big7_disk_output/canonical/COLO829/paired_full/20260315_COLO829_paired_full_full_complete_matrix",
      "physical_run_id": "current::COLO829/paired_full/20260315_COLO829_paired_full_full_complete_matrix",
      "published_at": null,
      "run_completed_at": null,
      "run_context_path": "/big7_disk/liaoyoyo2001/big7_disk_output/canonical/COLO829/paired_full/20260315_COLO829_paired_full_full_complete_matrix/run_context.json",
      "run_id": "20260315_COLO829_paired_full_full_complete_matrix",
      "run_started_at": null,
      "sample_id": "COLO829",
      "scope": "FULL",
      "source_created_at": "2026-03-16T06:22:49+08:00",
      "storage_state": "CURRENT",
      "verified_at": "2026-08-13T11:21:47+08:00"
    },
    {
      "availability": "LOCAL_CANONICAL",
      "evidence_status": "PARTIAL",
      "filesystem_mtime": "2026-04-21T04:57:16+08:00",
      "finality": "NON_FINAL",
      "known_limits": [
        "Physical directory presence and name do not establish scientific finality.",
        "Not present in the 18-row logical master manifest; directory is explicitly unregistered."
      ],
      "last_seen_at": "2026-08-13T11:21:47+08:00",
      "layout_class": "APR_FULL_RERUN",
      "logical_manifest_member": false,
      "logical_manifest_metadata": null,
      "logical_manifest_run_id": null,
      "machine_locations": [
        {
          "last_seen_at": "2026-08-13T11:21:47+08:00",
          "location_status": "PRESENT",
          "machine": "bip7",
          "path": "/big7_disk/liaoyoyo2001/big7_disk_output/canonical/COLO829/paired_full/20260421_COLO829_paired_full_full"
        }
      ],
      "mode": "paired_full",
      "physical_path": "/big7_disk/liaoyoyo2001/big7_disk_output/canonical/COLO829/paired_full/20260421_COLO829_paired_full_full",
      "physical_run_id": "current::COLO829/paired_full/20260421_COLO829_paired_full_full",
      "published_at": null,
      "run_completed_at": null,
      "run_context_path": null,
      "run_id": "20260421_COLO829_paired_full_full",
      "run_started_at": null,
      "sample_id": "COLO829",
      "scope": "FULL",
      "source_created_at": null,
      "storage_state": "CURRENT",
      "verified_at": "2026-08-13T11:21:47+08:00"
    },
    {
      "availability": "LOCAL_CANONICAL",
      "evidence_status": "PARTIAL",
      "filesystem_mtime": "2026-03-14T16:43:58+08:00",
      "finality": "NON_FINAL",
      "known_limits": [
        "Physical directory presence and name do not establish scientific finality.",
        "master manifest completeness_state=partial",
        "master manifest blocking_reason=missing_tagged_bam",
        "Logical master-manifest metadata was merged into this physical row; it is not a second run.",
        "tagged_bam_ready=false is a stale logical field and must not override physical artifact inventory."
      ],
      "last_seen_at": "2026-08-13T11:21:47+08:00",
      "layout_class": "MATERIALIZED_MANIFEST_BUNDLE",
      "logical_manifest_member": true,
      "logical_manifest_metadata": {
        "archive_root_label": "bip8_output_archive",
        "archive_run_path": "/big7_disk/liaoyoyo2001/big7_disk_output/bip8_output_archive/s-pure-pileup/COLO829/20260212_1",
        "baseline_ready": "true",
        "blocking_reason": "missing_tagged_bam",
        "caller_family": "ClairS",
        "caller_model": "pileup",
        "canonical_mode": "paired_pileup",
        "canonical_run_path": "/big7_disk/liaoyoyo2001/big7_disk_output/canonical/COLO829/paired_pileup/20260212_1_COLO829_paired_pileup_pileup",
        "completeness_state": "partial",
        "decision_metrics_ready": "true",
        "intersubmod_ready": "true",
        "methylation_status": "5mCG+5hmCG",
        "metrics_ready": "true",
        "paired_or_to": "paired",
        "platform": "ONT_PAO",
        "run_id": "20260212_1_COLO829_paired_pileup_pileup",
        "sample": "COLO829",
        "source_kind": "official_pipeline_run",
        "tagged_bam_ready": "false",
        "truth_ready": "true",
        "truth_set": "NYGC",
        "truth_total": "41427"
      },
      "logical_manifest_run_id": "20260212_1_COLO829_paired_pileup_pileup",
      "machine_locations": [
        {
          "last_seen_at": "2026-08-13T11:21:47+08:00",
          "location_status": "PRESENT",
          "machine": "bip7",
          "path": "/big7_disk/liaoyoyo2001/big7_disk_output/canonical/COLO829/paired_pileup/20260212_1_COLO829_paired_pileup_pileup"
        }
      ],
      "mode": "paired_pileup",
      "physical_path": "/big7_disk/liaoyoyo2001/big7_disk_output/canonical/COLO829/paired_pileup/20260212_1_COLO829_paired_pileup_pileup",
      "physical_run_id": "current::COLO829/paired_pileup/20260212_1_COLO829_paired_pileup_pileup",
      "published_at": null,
      "run_completed_at": null,
      "run_context_path": "/big7_disk/liaoyoyo2001/big7_disk_output/canonical/COLO829/paired_pileup/20260212_1_COLO829_paired_pileup_pileup/manifest/run_context.json",
      "run_id": "20260212_1_COLO829_paired_pileup_pileup",
      "run_started_at": null,
      "sample_id": "COLO829",
      "scope": "FULL",
      "source_created_at": "2026-03-14T18:23:47+08:00",
      "storage_state": "CURRENT",
      "verified_at": "2026-08-13T11:21:47+08:00"
    },
    {
      "availability": "LOCAL_CANONICAL",
      "evidence_status": "HISTORICAL",
      "filesystem_mtime": "2026-03-14T18:46:26+08:00",
      "finality": "NON_FINAL",
      "known_limits": [
        "Physical directory presence and name do not establish scientific finality.",
        "Not present in the 18-row logical master manifest; directory is explicitly unregistered."
      ],
      "last_seen_at": "2026-08-13T11:21:47+08:00",
      "layout_class": "SMOKECHECK",
      "logical_manifest_member": false,
      "logical_manifest_metadata": null,
      "logical_manifest_run_id": null,
      "machine_locations": [
        {
          "last_seen_at": "2026-08-13T11:21:47+08:00",
          "location_status": "PRESENT",
          "machine": "bip7",
          "path": "/big7_disk/liaoyoyo2001/big7_disk_output/canonical/COLO829/paired_pileup/20260314_COLO829_paired_pileup_pileup_smokecheck"
        }
      ],
      "mode": "paired_pileup",
      "physical_path": "/big7_disk/liaoyoyo2001/big7_disk_output/canonical/COLO829/paired_pileup/20260314_COLO829_paired_pileup_pileup_smokecheck",
      "physical_run_id": "current::COLO829/paired_pileup/20260314_COLO829_paired_pileup_pileup_smokecheck",
      "published_at": null,
      "run_completed_at": null,
      "run_context_path": null,
      "run_id": "20260314_COLO829_paired_pileup_pileup_smokecheck",
      "run_started_at": null,
      "sample_id": "COLO829",
      "scope": "DEMO",
      "source_created_at": null,
      "storage_state": "CURRENT",
      "verified_at": "2026-08-13T11:21:47+08:00"
    },
    {
      "availability": "LOCAL_CANONICAL",
      "evidence_status": "PARTIAL",
      "filesystem_mtime": "2026-03-16T06:50:26+08:00",
      "finality": "NON_FINAL",
      "known_limits": [
        "Physical directory presence and name do not establish scientific finality.",
        "Not present in the 18-row logical master manifest; directory is explicitly unregistered."
      ],
      "last_seen_at": "2026-08-13T11:21:47+08:00",
      "layout_class": "COMPLETE_MATRIX",
      "logical_manifest_member": false,
      "logical_manifest_metadata": null,
      "logical_manifest_run_id": null,
      "machine_locations": [
        {
          "last_seen_at": "2026-08-13T11:21:47+08:00",
          "location_status": "PRESENT",
          "machine": "bip7",
          "path": "/big7_disk/liaoyoyo2001/big7_disk_output/canonical/COLO829/paired_pileup/20260315_COLO829_paired_pileup_pileup_complete_matrix"
        }
      ],
      "mode": "paired_pileup",
      "physical_path": "/big7_disk/liaoyoyo2001/big7_disk_output/canonical/COLO829/paired_pileup/20260315_COLO829_paired_pileup_pileup_complete_matrix",